{
  "$schema": "../schema/enemy_type.schema.json",
  "id": "bat",
  "label": "Bat",
  "category": "minion",
  "sprite": { "art": "bat", "frames": 2 },
  "overworld": { "cells": ["bat_f0", "bat_f1"], "palette": "sprites" },
  "name": "BAT",
  "hp": 8,
  "max_hp": 8,
  "battle_id": "BATTLE_BAT",
  "ai_types": ["AI_PATROL_CIRCLE"],
  "gold_reward": 8,
  "reward_currency": "CURRENCY_ID_GOLD"
}