{
  "$schema": "../schema/enemy_type.schema.json",
  "id": "fire",
  "label": "Fire",
  "category": "minion",
  "sprite": null,
  "overworld": { "cells": ["fire_f0", "fire_f1"], "palette": "sprites5" },
  "name": "FIRE",
  "hp": 1,
  "max_hp": 1,
  "battle_id": "BATTLE_NONE",
  "gold_reward": 0,
  "reward_currency": "CURRENCY_ID_GOLD"
}
