{
  "$schema": "../schema/enemy_type.schema.json",
  "id": "npc_heal_mage",
  "label": "Heal Mage OW",
  "category": "minion",
  "sprite": null,
  "overworld": { "cells": ["npc_wizard"], "palette": "sprites8" },
  "name": "HEAL MAGE",
  "hp": 1,
  "max_hp": 1,
  "battle_id": "BATTLE_NONE",
  "gold_reward": 0,
  "reward_currency": "CURRENCY_ID_GOLD"
}
